{
  "type": "module",
  "name": "builtin_test",
  "imports": [],
  "functions": [
    {
      "type": "function",
      "name": "main",
      "params": [],
      "returns": "void",
      "body": [
        {
          "type": "assign",
          "target": "message",
          "value": {
            "type": "literal",
            "value": "Hello from ALaS builtin functions!"
          }
        },
        {
          "type": "expr",
          "value": {
            "type": "builtin",
            "name": "io.print",
            "args": [
              {
                "type": "variable",
                "name": "message"
              }
            ]
          }
        },
        {
          "type": "assign",
          "target": "sqrt_result",
          "value": {
            "type": "builtin",
            "name": "math.sqrt",
            "args": [
              {
                "type": "literal",
                "value": 16.0
              }
            ]
          }
        },
        {
          "type": "expr",
          "value": {
            "type": "builtin",
            "name": "io.print",
            "args": [
              {
                "type": "literal",
                "value": "\nsqrt(16) = "
              }
            ]
          }
        },
        {
          "type": "expr",
          "value": {
            "type": "builtin",
            "name": "io.print",
            "args": [
              {
                "type": "variable",
                "name": "sqrt_result"
              }
            ]
          }
        },
        {
          "type": "expr",
          "value": {
            "type": "builtin",
            "name": "io.print",
            "args": [
              {
                "type": "literal",
                "value": "\n"
              }
            ]
          }
        }
      ]
    }
  ]
}