{
  "type": "module",
  "name": "hello",
  "exports": ["greet", "farewell"],
  "functions": [
    {
      "type": "function",
      "name": "greet",
      "params": [
        {
          "name": "name",
          "type": "string"
        }
      ],
      "returns": "string",
      "body": [
        {
          "type": "return",
          "value": {
            "type": "binary",
            "op": "+",
            "left": {
              "type": "literal",
              "value": "Hello, "
            },
            "right": {
              "type": "binary",
              "op": "+",
              "left": {
                "type": "variable",
                "name": "name"
              },
              "right": {
                "type": "literal",
                "value": "!"
              }
            }
          }
        }
      ]
    },
    {
      "type": "function",
      "name": "farewell",
      "params": [
        {
          "name": "name",
          "type": "string"
        }
      ],
      "returns": "string",
      "body": [
        {
          "type": "return",
          "value": {
            "type": "binary",
            "op": "+",
            "left": {
              "type": "literal",
              "value": "Goodbye, "
            },
            "right": {
              "type": "binary",
              "op": "+",
              "left": {
                "type": "variable",
                "name": "name"
              },
              "right": {
                "type": "literal",
                "value": ". See you later!"
              }
            }
          }
        }
      ]
    }
  ]
}