{
  "type": "module",
  "name": "math_utils",
  "imports": ["std.math"],
  "exports": ["fibonacci", "prime_check", "gcd"],
  "functions": [
    {
      "type": "function",
      "name": "fibonacci",
      "params": [
        {
          "name": "n",
          "type": "int"
        }
      ],
      "returns": "int",
      "body": [
        {
          "type": "if",
          "cond": {
            "type": "binary",
            "op": "<=",
            "left": {
              "type": "variable",
              "name": "n"
            },
            "right": {
              "type": "literal",
              "value": 1
            }
          },
          "then": [
            {
              "type": "return",
              "value": {
                "type": "variable",
                "name": "n"
              }
            }
          ]
        },
        {
          "type": "return",
          "value": {
            "type": "binary",
            "op": "+",
            "left": {
              "type": "call",
              "name": "fibonacci",
              "args": [
                {
                  "type": "binary",
                  "op": "-",
                  "left": {
                    "type": "variable",
                    "name": "n"
                  },
                  "right": {
                    "type": "literal",
                    "value": 1
                  }
                }
              ]
            },
            "right": {
              "type": "call",
              "name": "fibonacci",
              "args": [
                {
                  "type": "binary",
                  "op": "-",
                  "left": {
                    "type": "variable",
                    "name": "n"
                  },
                  "right": {
                    "type": "literal",
                    "value": 2
                  }
                }
              ]
            }
          }
        }
      ]
    },
    {
      "type": "function",
      "name": "prime_check",
      "params": [
        {
          "name": "n",
          "type": "int"
        }
      ],
      "returns": "bool",
      "body": [
        {
          "type": "if",
          "cond": {
            "type": "binary",
            "op": "<=",
            "left": {
              "type": "variable",
              "name": "n"
            },
            "right": {
              "type": "literal",
              "value": 1
            }
          },
          "then": [
            {
              "type": "return",
              "value": {
                "type": "literal",
                "value": false
              }
            }
          ]
        },
        {
          "type": "if",
          "cond": {
            "type": "binary",
            "op": "<=",
            "left": {
              "type": "variable",
              "name": "n"
            },
            "right": {
              "type": "literal",
              "value": 3
            }
          },
          "then": [
            {
              "type": "return",
              "value": {
                "type": "literal",
                "value": true
              }
            }
          ]
        },
        {
          "type": "assign",
          "target": "i",
          "value": {
            "type": "literal",
            "value": 2
          }
        },
        {
          "type": "while",
          "cond": {
            "type": "binary",
            "op": "<=",
            "left": {
              "type": "binary",
              "op": "*",
              "left": {
                "type": "variable",
                "name": "i"
              },
              "right": {
                "type": "variable",
                "name": "i"
              }
            },
            "right": {
              "type": "variable",
              "name": "n"
            }
          },
          "body": [
            {
              "type": "if",
              "cond": {
                "type": "binary",
                "op": "==",
                "left": {
                  "type": "binary",
                  "op": "%",
                  "left": {
                    "type": "variable",
                    "name": "n"
                  },
                  "right": {
                    "type": "variable",
                    "name": "i"
                  }
                },
                "right": {
                  "type": "literal",
                  "value": 0
                }
              },
              "then": [
                {
                  "type": "return",
                  "value": {
                    "type": "literal",
                    "value": false
                  }
                }
              ]
            },
            {
              "type": "assign",
              "target": "i",
              "value": {
                "type": "binary",
                "op": "+",
                "left": {
                  "type": "variable",
                  "name": "i"
                },
                "right": {
                  "type": "literal",
                  "value": 1
                }
              }
            }
          ]
        },
        {
          "type": "return",
          "value": {
            "type": "literal",
            "value": true
          }
        }
      ]
    },
    {
      "type": "function",
      "name": "gcd",
      "params": [
        {
          "name": "a",
          "type": "int"
        },
        {
          "name": "b",
          "type": "int"
        }
      ],
      "returns": "int",
      "body": [
        {
          "type": "while",
          "cond": {
            "type": "binary",
            "op": "!=",
            "left": {
              "type": "variable",
              "name": "b"
            },
            "right": {
              "type": "literal",
              "value": 0
            }
          },
          "body": [
            {
              "type": "assign",
              "target": "temp",
              "value": {
                "type": "variable",
                "name": "b"
              }
            },
            {
              "type": "assign",
              "target": "b",
              "value": {
                "type": "binary",
                "op": "%",
                "left": {
                  "type": "variable",
                  "name": "a"
                },
                "right": {
                  "type": "variable",
                  "name": "b"
                }
              }
            },
            {
              "type": "assign",
              "target": "a",
              "value": {
                "type": "variable",
                "name": "temp"
              }
            }
          ]
        },
        {
          "type": "return",
          "value": {
            "type": "variable",
            "name": "a"
          }
        }
      ]
    }
  ]
}